{"authority_records":[{"authority_record_handoff_id":"74672397c79a9bc6865a73ba565f5167e7929bd59878bc3e41ead2420930efb0","coordinate_space_id":"10000000-0000-4000-8000-000000000004","endpoint_refs":[],"evidence_refs":["mesh_anchor:10000000-0000-4000-8000-000000000005"],"provenance_class":"user_annotation","record_id":"10000000-0000-4000-8000-000000000006","record_kind":"annotation","record_locator":"annotations/entities.json#annotation:10000000-0000-4000-8000-000000000006","resolved_endpoints":[],"resolved_evidence":[{"kind":"raw_visual_mesh_handoff","ref":"mesh_anchor:10000000-0000-4000-8000-000000000005","target":"34724a36fe89ade1c0613bde2f358c723dc187c15b5c01bc8b39d134a6dade50"}],"source_evidence_id":"1213f3206a16ffafef8ca98382e6a77322e4f2f105d32e959918e142b8d6a0ac","source_payload_sha256":"d56aa75bb30865377b778e05301482d6a85a4f9c6a9f517c28eb9d12197c93ec"},{"authority_record_handoff_id":"0e32a92497a6f950a32dd1cfd129e7e597c6ff47a976f8618a8e667ffcffab52","coordinate_space_id":"10000000-0000-4000-8000-000000000004","endpoint_refs":[],"evidence_refs":["user:tape_measure"],"provenance_class":"user_attested_measurement","record_id":"10000000-0000-4000-8000-000000000007","record_kind":"measurement","record_locator":"annotations/measurements.json#measurement:10000000-0000-4000-8000-000000000007","resolved_endpoints":[],"resolved_evidence":[{"kind":"annotation_authored","ref":"user:tape_measure","target":null}],"source_evidence_id":"6900751a484741549293a2aff4b01d22636bf544a553af52fb12402598d317ba","source_payload_sha256":"b9721a6bb449b5d843cf2d7b7be296ea92451b6ea3afd18236725bdd72e6aa8d"}],"bundle":{"bundle_digest":"e12b3e9c43fe8b26b151cde32acbbf19e56447750447955ead65e1477c9fcb8a","capture_revision_id":"10000000-0000-4000-8000-000000000002","capture_schema":"htdt.capture.bundle","capture_schema_version":"1.0.0","capture_series_id":"10000000-0000-4000-8000-000000000001","capture_session_ids":["10000000-0000-4000-8000-000000000003"],"coordinate_space_ids":["10000000-0000-4000-8000-000000000004"],"parent_revision_id":null},"ingestor":{"configuration_digest":"3e27eec298714a04fc6b48d94b354168396e2c4eea0cf9aa8284fa552de562b3","name":"htdt-capture-reference-ingestor","version":"1.0.0"},"lineage_digest":"92e81abef2304f4f8bdecbacff394af0ac0e34ed6a33d2321e711fc6b433b69f","raw_visual_mesh_handoffs":[{"T_world_from_mesh_anchor":{"representation":"column_major_4x4_f32","values":[1,0,0,0,0,1,0,0,0,0,1,0,0,0,0,1]},"anchor_id":"10000000-0000-4000-8000-000000000005","anchor_index_source_evidence_id":"5e8e18ae568a0bf8a873b5dae912b9d3b32681939d1df3169a41814ab6ea50b3","anchor_record_locator":"mesh/anchors.json#anchor:10000000-0000-4000-8000-000000000005","bundle_digest":"e12b3e9c43fe8b26b151cde32acbbf19e56447750447955ead65e1477c9fcb8a","capture_session_id":"10000000-0000-4000-8000-000000000003","coordinate_space_id":"10000000-0000-4000-8000-000000000004","face_count":1,"geometry_path":"mesh/geometry/10000000-0000-4000-8000-000000000005.meshbin","geometry_sha256":"9cf9198c431c6a803ecef625cfa96f1ea1b535b536782f4cb272b42e143d9276","geometry_source_evidence_id":"3b2d1fd68f5214a2c33b1fdf619b36bb9a3a684f1713c3d8df3f898928413e39","raw_visual_mesh_handoff_id":"34724a36fe89ade1c0613bde2f358c723dc187c15b5c01bc8b39d134a6dade50","session_timestamp_s":12.5,"vertex_count":3}],"roomplan_capture_metadata":null,"roomplan_records":[{"kind":"raw_scan","path":"roomplan/captured-room-data.json","payload_sha256":"557f2b4ab99fdaede97b716a3c75280e2c7a87d0e7b7769092f57c99639d2bfe","provenance_class":"apple_roomplan_raw_scan","roomplan_capture_metadata":null,"source_evidence_id":"0e984288b2c869ed7113f02f7c19412a969be132bbab1f3a1e5a638f86cfec6a","source_refs":[]},{"kind":"postprocessed_inference","path":"roomplan/captured-room.json","payload_sha256":"895df1a9d6ce4486761b1205b7e24d13b9e3a96c3edb9a53b901a3bfb68546ed","provenance_class":"apple_roomplan_inference","roomplan_capture_metadata":null,"source_evidence_id":"3c724c5052dd57c115d813b738daa755236f4bcb140240c16cbc2e8a32d7aa7b","source_refs":["sha256:557f2b4ab99fdaede97b716a3c75280e2c7a87d0e7b7769092f57c99639d2bfe"]}],"schema":"htdt.capture.ingestion-plan","schema_version":"1.0.0","source_evidence":[{"bundle_digest":"e12b3e9c43fe8b26b151cde32acbbf19e56447750447955ead65e1477c9fcb8a","bytes":873,"capture_revision_id":"10000000-0000-4000-8000-000000000002","media_type":"application/json","path":"annotations/entities.json","payload_sha256":"d56aa75bb30865377b778e05301482d6a85a4f9c6a9f517c28eb9d12197c93ec","producer":"annotation","provenance_class":"user_annotation","role":"canonical","source_evidence_id":"1213f3206a16ffafef8ca98382e6a77322e4f2f105d32e959918e142b8d6a0ac","source_refs":[]},{"bundle_digest":"e12b3e9c43fe8b26b151cde32acbbf19e56447750447955ead65e1477c9fcb8a","bytes":476,"capture_revision_id":"10000000-0000-4000-8000-000000000002","media_type":"application/json","path":"annotations/measurements.json","payload_sha256":"b9721a6bb449b5d843cf2d7b7be296ea92451b6ea3afd18236725bdd72e6aa8d","producer":"measurement","provenance_class":"user_attested_measurement","role":"canonical","source_evidence_id":"6900751a484741549293a2aff4b01d22636bf544a553af52fb12402598d317ba","source_refs":[]},{"bundle_digest":"e12b3e9c43fe8b26b151cde32acbbf19e56447750447955ead65e1477c9fcb8a","bytes":582,"capture_revision_id":"10000000-0000-4000-8000-000000000002","media_type":"application/json","path":"mesh/anchors.json","payload_sha256":"4e604bef55045c5f3191677165a04f2c6802e2193d063f42f5009bc5df034906","producer":"mesh_capture","provenance_class":"arkit_mesh_reconstruction","role":"canonical","source_evidence_id":"5e8e18ae568a0bf8a873b5dae912b9d3b32681939d1df3169a41814ab6ea50b3","source_refs":["path:mesh/geometry/10000000-0000-4000-8000-000000000005.meshbin"]},{"bundle_digest":"e12b3e9c43fe8b26b151cde32acbbf19e56447750447955ead65e1477c9fcb8a","bytes":80,"capture_revision_id":"10000000-0000-4000-8000-000000000002","media_type":"application/vnd.htdt.meshbin","path":"mesh/geometry/10000000-0000-4000-8000-000000000005.meshbin","payload_sha256":"9cf9198c431c6a803ecef625cfa96f1ea1b535b536782f4cb272b42e143d9276","producer":"mesh_capture","provenance_class":"arkit_mesh_reconstruction","role":"canonical","source_evidence_id":"3b2d1fd68f5214a2c33b1fdf619b36bb9a3a684f1713c3d8df3f898928413e39","source_refs":[]},{"bundle_digest":"e12b3e9c43fe8b26b151cde32acbbf19e56447750447955ead65e1477c9fcb8a","bytes":525,"capture_revision_id":"10000000-0000-4000-8000-000000000002","media_type":"application/json","path":"quality/capture-quality.json","payload_sha256":"d8d97877e49990bb1d92854595b010a92165b215121c4dfd047590cc523d6c5f","producer":"capture_quality","provenance_class":"capture_app_derived","role":"canonical","source_evidence_id":"3d03938e6a84ef04b632b49a8a2c94e5d768dcd413955212e56daa2983d6eb96","source_refs":[]},{"bundle_digest":"e12b3e9c43fe8b26b151cde32acbbf19e56447750447955ead65e1477c9fcb8a","bytes":87,"capture_revision_id":"10000000-0000-4000-8000-000000000002","media_type":"application/json","path":"roomplan/captured-room-data.json","payload_sha256":"557f2b4ab99fdaede97b716a3c75280e2c7a87d0e7b7769092f57c99639d2bfe","producer":"roomplan_capture","provenance_class":"apple_roomplan_raw_scan","role":"canonical","source_evidence_id":"0e984288b2c869ed7113f02f7c19412a969be132bbab1f3a1e5a638f86cfec6a","source_refs":[]},{"bundle_digest":"e12b3e9c43fe8b26b151cde32acbbf19e56447750447955ead65e1477c9fcb8a","bytes":176,"capture_revision_id":"10000000-0000-4000-8000-000000000002","media_type":"application/json","path":"roomplan/captured-room.json","payload_sha256":"895df1a9d6ce4486761b1205b7e24d13b9e3a96c3edb9a53b901a3bfb68546ed","producer":"roomplan_builder","provenance_class":"apple_roomplan_inference","role":"canonical","source_evidence_id":"3c724c5052dd57c115d813b738daa755236f4bcb140240c16cbc2e8a32d7aa7b","source_refs":["sha256:557f2b4ab99fdaede97b716a3c75280e2c7a87d0e7b7769092f57c99639d2bfe"]},{"bundle_digest":"e12b3e9c43fe8b26b151cde32acbbf19e56447750447955ead65e1477c9fcb8a","bytes":232,"capture_revision_id":"10000000-0000-4000-8000-000000000002","media_type":"application/json","path":"session/capture-configuration.json","payload_sha256":"8f413a14a55e2d75ab55e5781ff526307fe15b60bb02f206e71d0c48ea79f481","producer":"capture_session","provenance_class":"capture_app_derived","role":"canonical","source_evidence_id":"b42fbd648af12ba3dee4fcd081e4b1283801bd92ef21f56a5d913e8515304ee5","source_refs":[]},{"bundle_digest":"e12b3e9c43fe8b26b151cde32acbbf19e56447750447955ead65e1477c9fcb8a","bytes":338,"capture_revision_id":"10000000-0000-4000-8000-000000000002","media_type":"application/json","path":"session/capture-session.json","payload_sha256":"be29c511aea4bcb0fddb1702cbadf6e58429a46df2f4900ca7e532e8833db51e","producer":"capture_session","provenance_class":"capture_app_derived","role":"canonical","source_evidence_id":"36d33ff9fa446a14c49c079fe97be4e63ed891f9c81c9d5c274e0d34fa25c5f5","source_refs":["path:session/capture-configuration.json","path:session/timing.json"]},{"bundle_digest":"e12b3e9c43fe8b26b151cde32acbbf19e56447750447955ead65e1477c9fcb8a","bytes":241,"capture_revision_id":"10000000-0000-4000-8000-000000000002","media_type":"application/json","path":"session/timing.json","payload_sha256":"a7fd29a72c9e549c8c68cb46666a6c0221355f21de4d28693c200d252d54ad19","producer":"capture_session","provenance_class":"capture_app_derived","role":"canonical","source_evidence_id":"f1aa52df48ff7aaaa586a774a811b75737b205b9125185e419166e6e5aaab74b","source_refs":[]}]}